{"artifactId":"a79dc016-dfdf-419b-8ddb-5aa7bf1f2933","schema":"oan.hopng_universe_layer","schemaVersion":"0.1.0","universes":[{"coordinateFrame":{"units":"pixel-relative","xAxis":"x","yAxis":"y","zAxis":"z"},"modality":"visual-symbolic","neutralPlane":0,"projectionRole":"projection-surface","universeId":"prime-projection"},{"coordinateFrame":{"units":"relative-pressure","xAxis":"x","yAxis":"y","zAxis":"z"},"modality":"cryptic-support","neutralPlane":0,"projectionRole":"projection-surface","universeId":"cryptic-support"}]}